<?xml version="1.0" encoding="UTF-8"?>
<fourwhisky xmlns:xsi="http://www.w3.org/2001/XMLSchema-instance" xsi:noNamespaceSchemaLocation="fourwhisky.xsd">
<message_identification set-seq="40" setId="MSGID">
<command ff-seq="1">VAUMILICONVERT</command>
<message_identifier ff-seq="2">4WHISKY</message_identifier>
<message_serial_no ff-seq="3">26184</message_serial_no>
<month ff-seq="4">JAN</month>
<operexer_name ff-seq="5">PEACOMLL</operexer_name>
<qualifier ff-seq="6">PER</qualifier>
<qualifier_serial_no ff-seq="7">012</qualifier_serial_no>
</message_identification>
<security set-seq="41" setId="SEC">
<classification ff-seq="1">CONFIDENTIAL</classification>
<amplifying_info ff-seq="2">SPECIAL FRANCE</amplifying_info>
</security>
<addressees set-seq="42" setId="ADDEE">
<address ff-seq="1">GCCS-M</address>
<address_1 ff-seq="2">GCCS-M</address_1>
<address_2 ff-seq="3">GCCS-M</address_2>
<address_3 ff-seq="4">GCCS-M</address_3>
<address_4 ff-seq="5">GCCS-M</address_4>
<address_5 ff-seq="6">GCCS-M</address_5>
<address_6 ff-seq="7">GCCS-M</address_6>
</addressees>
<addressees set-seq="42" setId="ADDEE">
<address ff-seq="1">GCCS-M</address>
<address_1 ff-seq="2">GCCS-M</address_1>
<address_2 ff-seq="3">GCCS-M</address_2>
<address_3 ff-seq="4">GCCS-M</address_3>
<address_4 ff-seq="5">GCCS-M</address_4>
<address_5 ff-seq="6">GCCS-M</address_5>
<address_6 ff-seq="7">GCCS-1</address_6>
</addressees>
<addressees set-seq="42" setId="ADDEE">
<address ff-seq="1">GCCS-M</address>
<address_1 ff-seq="2">GCCS-M</address_1>
<address_2 ff-seq="3">GCCS-M</address_2>
<address_3 ff-seq="4">GCCS-M</address_3>
<address_4 ff-seq="5">GCCS-M</address_4>
<address_5 ff-seq="6">GCCS-M</address_5>
<address_6 ff-seq="7">GCCS-2</address_6>
</addressees>
<_4-whisky set-seq="43" setId="WHSKY">
<name ff-seq="1">SARKOZY</name>
<no_of_grid_cells ff-seq="2">36</no_of_grid_cells>
<grid_cell_size ff-seq="3">10NM</grid_cell_size>
<pim_cell ff-seq="4">N13</pim_cell>
<remarks ff-seq="5">CEST UN TEST</remarks>
</_4-whisky>
<_4-whisky_unit set-seq="44" setId="WUNIT">
<unit_name ff-seq="1">CV</unit_name>
<unit_assignment ff-seq="2">QT1520</unit_assignment>
</_4-whisky_unit>
<_4-whisky_unit set-seq="44" setId="WUNIT">
<unit_name ff-seq="1">DE</unit_name>
<unit_assignment ff-seq="2">JL0812</unit_assignment>
</_4-whisky_unit>
<_4-whisky_unit set-seq="44" setId="WUNIT">
<unit_name ff-seq="1">AO</unit_name>
<unit_assignment ff-seq="2">XZ0812</unit_assignment>
</_4-whisky_unit>
<_4-whisky_unit set-seq="44" setId="WUNIT">
<unit_name ff-seq="1">FF</unit_name>
<unit_assignment ff-seq="2">JL2428+LM2526</unit_assignment>
</_4-whisky_unit>
<_4-whisky_unit set-seq="44" setId="WUNIT">
<unit_name ff-seq="1">EISENHOWER DD</unit_name>
<unit_assignment ff-seq="2">CF04+C0506+F0506</unit_assignment>
</_4-whisky_unit>
<_4-whisky_unit set-seq="44" setId="WUNIT">
<unit_name ff-seq="1">ENTERPRISE</unit_name>
<unit_assignment ff-seq="2">DM1219</unit_assignment>
</_4-whisky_unit>
<end_of_data set-seq="45" setId="ENDAT">
<derivation_source_for_clsif ff-seq="1">CNO (N10) LTR SER GS123456 OF 20JAN00</derivation_source_for_clsif>
<dwngrd_or_declass_inst ff-seq="2">INST:UPON COMPLETION</dwngrd_or_declass_inst>
<dwngrd_or_declass_exempt_code ff-seq="3">OF PROJECT BIG JUMP</dwngrd_or_declass_exempt_code>
</end_of_data>
</fourwhisky>
