<?xml version="1.0" encoding="UTF-8"?>
<fourwhisky xmlns:xsi="http://www.w3.org/2001/XMLSchema-instance" xsi:noNamespaceSchemaLocation="fourwhisky.xsd">
<message_identification set-seq="40" setId="MSGID">
<command ff-seq="1">-</command>
<message_identifier ff-seq="2">4WHISKY</message_identifier>
<message_serial_no ff-seq="3">0001</message_serial_no>
<month ff-seq="4">FEB</month>
<operexer_name ff-seq="5">JULIEN</operexer_name>
</message_identification>
<_4-whisky set-seq="43" setId="WHSKY">
<name ff-seq="1">ZONE JULIEN</name>
<no_of_grid_cells ff-seq="2">30</no_of_grid_cells>
<grid_cell_size ff-seq="3">30NM</grid_cell_size>
<pim_cell ff-seq="4">Q15</pim_cell>
</_4-whisky>
<_4-whisky_unit set-seq="44" setId="WUNIT">
<unit_name ff-seq="1">TOTO</unit_name>
<unit_assignment ff-seq="2">H25+P22+Q15+L17+L20+Q20+Q21+R20+R21</unit_assignment>
</_4-whisky_unit>
<end_of_data set-seq="45" setId="ENDAT"/>
</fourwhisky>
